{
  "objective": "Code review of discoverModel() implementation and model auto-population in store-cli.cjs",
  "findings": [
    "Implementation matches approved plan exactly: discoverModel() with 3-env-var priority, 'unknown' fallback",
    "Auto-population in cmdEmit() runs after timestamp normalization, before schema validation -- correct order",
    "Auto-population in cmdRecordUsage() runs before sidecar schema validation -- correct order",
    "Explicit model values preserved in both paths -- no silent override of caller intent",
    "No npm dependencies, no schema changes, no hardcoded paths, no security concerns",
    "13 new tests pass: 6 discoverModel unit tests, 4 emit auto-population, 2 record-usage auto-population, 1 preservation",
    "All 577 tests pass, validate-store --dry-run passes, node --check passes",
    "Version bump, migration entry, and security scan deferred to sprint release engineering (acceptable)"
  ],
  "verdict": "approved",
  "written_at": "2026-04-20T19:30:00Z",
  "artifact_ref": "CODE_REVIEW.md"
}