{
  "objective": "Validate that store-write verification loop meets all acceptance criteria",
  "findings": [
    "AC1 PASS: Schema violation retry pattern documented in Store-Write Verification section",
    "AC2 PASS: Halting behavior at write steps confirmed with inline instructions",
    "AC3 PASS: No performance regression — verification only on failure",
    "AC4 PARTIAL: meta-sprint-plan.md has full section; meta-orchestrate.md has equivalent Write-Boundary Contract",
    "AC5 PASS: No JS/CJS files modified — only Markdown",
    "AC6 PASS: 565/565 tests pass",
    "All technical constraints verified: no npm, no schema changes, backwards compatible",
    "validate-store --dry-run passes",
    "Lint checks pass on all existing tools and hooks"
  ],
  "verdict": "approved",
  "written_at": "2026-04-20T19:40:00Z",
  "artifact_ref": "VALIDATION_REPORT.md"
}