{
  "objective": "Replace the dead-end in /forge:calibrate Step 2 with auto-initialization that computes and writes the calibration baseline when absent, mirroring init Phase 5 behavior.",
  "key_changes": [
    "Replace Step 2 early-exit with auto-initialization logic in calibrate.md",
    "Reuse existing baseline computation algorithm (MASTER_INDEX.md hash + completed sprint IDs)",
    "Write baseline to .forge/config.json and report success instead of dead-ending",
    "No schema changes — calibrationBaseline schema already exists"
  ],
  "verdict": "n/a",
  "written_at": "2026-04-20T12:00:00Z",
  "artifact_ref": "PLAN.md"
}