{
  "objective": "Validate that discoverModel() implementation satisfies all acceptance criteria for deterministic model discovery",
  "findings": [
    "AC1 PASS: Event records capture actual runtime model from CLAUDE_CODE_SUBAGENT_MODEL env var",
    "AC2 PASS: Returns 'unknown' when no env var set instead of incorrect Anthropic model name",
    "AC3 PASS: Works across Claude Code, ollama, and other providers via env var priority",
    "AC4 PASS: node --check passes on store-cli.cjs",
    "AC5 PASS: 577/577 tests pass including 13 new discoverModel/auto-population tests",
    "No npm dependencies introduced; no schema changes; backwards compatible",
    "Version bump, migration entry, and security scan deferred to sprint release engineering",
    "Edge cases verified: empty string, missing key, whitespace trimming, explicit model preservation"
  ],
  "verdict": "approved",
  "written_at": "2026-04-20T19:45:00Z",
  "artifact_ref": "VALIDATION_REPORT.md"
}